{
  "contractVersion": "1.1.0",
  "courseId": "american-football",
  "displayName": "American Football",
  "category": "Sports",
  "family": "Sports",
  "status": "not-started",
  "wave": 1,
  "simulationPrefix": "football",
  "branches": [
    {
      "id": "nfl",
      "displayName": "NFL",
      "personalizationDimension": "league"
    },
    {
      "id": "college-football",
      "displayName": "College Football",
      "personalizationDimension": "league"
    }
  ],
  "curriculumVersion": "0.1.0",
  "foundationalModules": [
    {
      "id": "the-basics",
      "title": "The basics",
      "summary": "Downs, the clock, positions."
    },
    {
      "id": "defense-basics",
      "title": "Reading the defense"
    }
  ],
  "interactionTypes": [
    "multiple-choice",
    "fill-the-gap",
    "term-match",
    "estimate-slider",
    "hotspot-tap",
    "say-this",
    "talk-track",
    "unity-sim"
  ],
  "unitySimulations": [
    {
      "simulationId": "football.coverage.read.v1",
      "specPath": "docs/courses/american-football/sims/football.coverage.read.v1.md",
      "status": "planned",
      "lessonIds": [
        "coverage-04"
      ]
    }
  ],
  "nativeExercises": [
    {
      "exerciseType": "multiple-choice",
      "specPath": "docs/courses/american-football/exercises.md"
    },
    {
      "exerciseType": "say-this",
      "specPath": "docs/courses/american-football/exercises.md"
    }
  ],
  "dynamicData": [
    {
      "kind": "scores",
      "providerCandidates": [
        "TheSportsDB"
      ],
      "refreshFrequency": "minutes-during-events"
    },
    {
      "kind": "standings",
      "providerCandidates": [
        "TheSportsDB"
      ],
      "refreshFrequency": "daily"
    },
    {
      "kind": "news",
      "providerCandidates": [
        "licensed news API (TBD via open question)"
      ],
      "refreshFrequency": "hourly"
    },
    {
      "kind": "injuries",
      "providerCandidates": [
        "Official team injury reports (link)"
      ],
      "refreshFrequency": "daily",
      "notes": "Weekly report Wednesday to Friday plus game-day inactives."
    }
  ],
  "editorial": {
    "approach": "explain-and-link",
    "sources": [
      "Publisher headlines and links only"
    ],
    "topicsWeExplain": [
      "why an injury matters",
      "why a coaching decision is controversial"
    ],
    "copyrightPolicy": "Publisher article text is never copied; Swoon'd writes its own explanation and links to the original."
  },
  "personalizationDimensions": [
    "team",
    "player",
    "league"
  ],
  "conversationScenarios": {
    "count": 1,
    "path": "docs/courses/american-football/curriculum/"
  },
  "masteryModel": {
    "type": "concept-mastery-v1",
    "passThreshold": 0.8,
    "usefulCompetenceStatement": "Can follow a game with a fan, decode common fan talk, and ask a meaningful follow-up question."
  },
  "licensingConstraints": [
    {
      "area": "logos-trademarks",
      "constraint": "No NFL/team logos or player likeness without license; use team names as text only."
    },
    {
      "area": "data-provider-terms",
      "constraint": "Follow TheSportsDB terms; attribute where required."
    }
  ],
  "safetyConstraints": [],
  "relatedCourses": [
    {
      "courseId": "basketball",
      "relationship": "adjacent"
    }
  ]
}
